{
  "package": "oats.framework",
  "version": "1.10.2",
  "description": "Explicit OATS operation and setup guidance, the support desk role, optional reference knowledge theory, and the knowledge-theory-expert package soul.",
  "compatibility": { "oats": ">=0.24.0" },
  "capabilities": ["capabilities/oats-knowledge-theory", "capabilities/oats-core", "capabilities/oats-setup", "capabilities/oats-support"],
  "souls": ["souls/knowledge-theory-expert"]
}
